[
  {
    "category": "optical",
    "conditions": {
      "method": "o and e polarization, 390-3800 nm"
    },
    "default": true,
    "id": "absorption-coefficient/cln/leidinger2015",
    "kind": "scalar",
    "max": 2,
    "min": 0.0001,
    "name": "Absorption coefficient in the transparent range",
    "notes": "Range over 390-3800 nm ('< 1.0e-4 to 2 cm^-1'); the value at 1550 nm is in the paper and was not read. 1.0e-4 cm^-1 = 0.043 dB/m.",
    "property": "absorption-coefficient",
    "provenance": {
      "locator": "abstract",
      "source_id": "leidinger2015",
      "status": "P(abs)",
      "transcribed": "2026-10-25"
    },
    "public": true,
    "symbol": "alpha",
    "unit": {
      "display": "cm^-1",
      "ucum": "/cm"
    },
    "variant": "cln"
  },
  {
    "category": "optical",
    "conditions": {
      "temperature_C": 21,
      "wavelength_nm": 1064.0
    },
    "default": true,
    "id": "birefringence/cln/zelmon1997-1064nm",
    "kind": "scalar",
    "name": "Birefringence n_e - n_o",
    "notes": "Negative: LiNbO3 is negative uniaxial (n_e < n_o).",
    "property": "birefringence",
    "provenance": {
      "derivation": "evaluated from dispersion model zelmon1997-cln-e minus zelmon1997-cln-o at 1064 nm, 21 C by scripts/build_data.py (rounded to 1e-4)",
      "source_id": "zelmon1997",
      "status": "C",
      "transcribed": "2026-10-25"
    },
    "public": true,
    "symbol": "n_e - n_o",
    "unit": {
      "display": "-",
      "qudt": "http://qudt.org/vocab/unit/UNITLESS",
      "ucum": "1"
    },
    "value": -0.0766,
    "variant": "cln"
  },
  {
    "category": "optical",
    "conditions": {
      "temperature_C": 21,
      "wavelength_nm": 1550.0
    },
    "default": true,
    "id": "birefringence/cln/zelmon1997-1550nm",
    "kind": "scalar",
    "name": "Birefringence n_e - n_o",
    "notes": "Negative: LiNbO3 is negative uniaxial (n_e < n_o).",
    "property": "birefringence",
    "provenance": {
      "derivation": "evaluated from dispersion model zelmon1997-cln-e minus zelmon1997-cln-o at 1550 nm, 21 C by scripts/build_data.py (rounded to 1e-4)",
      "source_id": "zelmon1997",
      "status": "C",
      "transcribed": "2026-10-25"
    },
    "public": true,
    "symbol": "n_e - n_o",
    "unit": {
      "display": "-",
      "qudt": "http://qudt.org/vocab/unit/UNITLESS",
      "ucum": "1"
    },
    "value": -0.0736,
    "variant": "cln"
  },
  {
    "category": "optical",
    "conditions": {
      "temperature_C": 21,
      "wavelength_nm": 632.8
    },
    "default": true,
    "id": "birefringence/cln/zelmon1997-632.8nm",
    "kind": "scalar",
    "name": "Birefringence n_e - n_o",
    "notes": "Negative: LiNbO3 is negative uniaxial (n_e < n_o).",
    "property": "birefringence",
    "provenance": {
      "derivation": "evaluated from dispersion model zelmon1997-cln-e minus zelmon1997-cln-o at 632.8 nm, 21 C by scripts/build_data.py (rounded to 1e-4)",
      "source_id": "zelmon1997",
      "status": "C",
      "transcribed": "2026-10-25"
    },
    "public": true,
    "symbol": "n_e - n_o",
    "unit": {
      "display": "-",
      "qudt": "http://qudt.org/vocab/unit/UNITLESS",
      "ucum": "1"
    },
    "value": -0.0842,
    "variant": "cln"
  },
  {
    "category": "optical",
    "conditions": {
      "temperature_C": 21,
      "wavelength_nm": 1064.0
    },
    "default": true,
    "id": "birefringence/mgo5-cln/zelmon1997-1064nm",
    "kind": "scalar",
    "name": "Birefringence n_e - n_o",
    "notes": "Negative: LiNbO3 is negative uniaxial (n_e < n_o).",
    "property": "birefringence",
    "provenance": {
      "derivation": "evaluated from dispersion model zelmon1997-mgo5-e minus zelmon1997-mgo5-o at 1064 nm, 21 C by scripts/build_data.py (rounded to 1e-4)",
      "source_id": "zelmon1997",
      "status": "C",
      "transcribed": "2026-10-25"
    },
    "public": true,
    "symbol": "n_e - n_o",
    "unit": {
      "display": "-",
      "qudt": "http://qudt.org/vocab/unit/UNITLESS",
      "ucum": "1"
    },
    "value": -0.0815,
    "variant": "mgo5-cln"
  },
  {
    "category": "optical",
    "conditions": {
      "temperature_C": 21,
      "wavelength_nm": 1550.0
    },
    "default": true,
    "id": "birefringence/mgo5-cln/zelmon1997-1550nm",
    "kind": "scalar",
    "name": "Birefringence n_e - n_o",
    "notes": "Negative: LiNbO3 is negative uniaxial (n_e < n_o).",
    "property": "birefringence",
    "provenance": {
      "derivation": "evaluated from dispersion model zelmon1997-mgo5-e minus zelmon1997-mgo5-o at 1550 nm, 21 C by scripts/build_data.py (rounded to 1e-4)",
      "source_id": "zelmon1997",
      "status": "C",
      "transcribed": "2026-10-25"
    },
    "public": true,
    "symbol": "n_e - n_o",
    "unit": {
      "display": "-",
      "qudt": "http://qudt.org/vocab/unit/UNITLESS",
      "ucum": "1"
    },
    "value": -0.0782,
    "variant": "mgo5-cln"
  },
  {
    "category": "optical",
    "conditions": {
      "temperature_C": 21,
      "wavelength_nm": 632.8
    },
    "default": true,
    "id": "birefringence/mgo5-cln/zelmon1997-632.8nm",
    "kind": "scalar",
    "name": "Birefringence n_e - n_o",
    "notes": "Negative: LiNbO3 is negative uniaxial (n_e < n_o).",
    "property": "birefringence",
    "provenance": {
      "derivation": "evaluated from dispersion model zelmon1997-mgo5-e minus zelmon1997-mgo5-o at 632.8 nm, 21 C by scripts/build_data.py (rounded to 1e-4)",
      "source_id": "zelmon1997",
      "status": "C",
      "transcribed": "2026-10-25"
    },
    "public": true,
    "symbol": "n_e - n_o",
    "unit": {
      "display": "-",
      "qudt": "http://qudt.org/vocab/unit/UNITLESS",
      "ucum": "1"
    },
    "value": -0.0897,
    "variant": "mgo5-cln"
  },
  {
    "category": "acoustic",
    "conditions": {
      "method": "plane-wave ultrasonic, (110) plate"
    },
    "default": true,
    "id": "bulk-velocity-longitudinal-x/cln/kushibiki1999",
    "kind": "scalar",
    "name": "Bulk longitudinal velocity along X",
    "property": "bulk-velocity-longitudinal-x",
    "provenance": {
      "locator": "Table II",
      "source_id": "kushibiki1999",
      "status": "P",
      "transcribed": "2026-10-25"
    },
    "public": true,
    "symbol": "v_L,X",
    "uncertainty": {
      "type": "stated",
      "value": 0.3
    },
    "unit": {
      "display": "m/s",
      "ucum": "m/s"
    },
    "value": 6544.53,
    "variant": "cln"
  },
  {
    "category": "acoustic",
    "conditions": {
      "method": "plane-wave ultrasonic, (300) plate"
    },
    "default": true,
    "id": "bulk-velocity-longitudinal-y/cln/kushibiki1999",
    "kind": "scalar",
    "name": "Bulk longitudinal velocity along Y",
    "property": "bulk-velocity-longitudinal-y",
    "provenance": {
      "locator": "Table II",
      "source_id": "kushibiki1999",
      "status": "P",
      "transcribed": "2026-10-25"
    },
    "public": true,
    "symbol": "v_L,Y",
    "uncertainty": {
      "type": "stated",
      "value": 0.26
    },
    "unit": {
      "display": "m/s",
      "ucum": "m/s"
    },
    "value": 6806.55,
    "variant": "cln"
  },
  {
    "category": "acoustic",
    "conditions": {
      "method": "plane-wave ultrasonic, (006) plate"
    },
    "default": true,
    "id": "bulk-velocity-longitudinal-z/cln/kushibiki1999",
    "kind": "scalar",
    "name": "Bulk longitudinal velocity along Z",
    "notes": "Reproduced to 0.4 m/s by the piezo-stiffened velocity from the kushibiki1999 constants (consistency check in the tensor records).",
    "property": "bulk-velocity-longitudinal-z",
    "provenance": {
      "locator": "Table II",
      "source_id": "kushibiki1999",
      "status": "P",
      "transcribed": "2026-10-25"
    },
    "public": true,
    "symbol": "v_L,Z",
    "uncertainty": {
      "type": "stated",
      "value": 0.32
    },
    "unit": {
      "display": "m/s",
      "ucum": "m/s"
    },
    "value": 7328.2,
    "variant": "cln",
    "variant_note": "SAW-grade congruent"
  },
  {
    "category": "acoustic",
    "conditions": {
      "method": "resonance, (110) plate"
    },
    "default": true,
    "id": "bulk-velocity-shear-x/cln/kushibiki1999",
    "kind": "scalar",
    "name": "Bulk shear velocity along X (resonance)",
    "property": "bulk-velocity-shear-x",
    "provenance": {
      "locator": "Table II",
      "source_id": "kushibiki1999",
      "status": "P",
      "transcribed": "2026-10-25"
    },
    "public": true,
    "symbol": "v_S,X",
    "uncertainty": {
      "type": "stated",
      "value": 0.59
    },
    "unit": {
      "display": "m/s",
      "ucum": "m/s"
    },
    "value": 4750.67,
    "variant": "cln"
  },
  {
    "category": "acoustic",
    "conditions": {
      "method": "plane-wave ultrasonic, (300) plate"
    },
    "default": true,
    "id": "bulk-velocity-shear-y/cln/kushibiki1999",
    "kind": "scalar",
    "name": "Bulk shear velocity along Y",
    "property": "bulk-velocity-shear-y",
    "provenance": {
      "locator": "Table II",
      "source_id": "kushibiki1999",
      "status": "P",
      "transcribed": "2026-10-25"
    },
    "public": true,
    "symbol": "v_S,Y",
    "uncertainty": {
      "type": "stated",
      "value": 0.21
    },
    "unit": {
      "display": "m/s",
      "ucum": "m/s"
    },
    "value": 3940.49,
    "variant": "cln"
  },
  {
    "category": "acoustic",
    "conditions": {
      "method": "plane-wave ultrasonic, (006) plate"
    },
    "default": true,
    "id": "bulk-velocity-shear-z/cln/kushibiki1999",
    "kind": "scalar",
    "name": "Bulk shear velocity along Z",
    "property": "bulk-velocity-shear-z",
    "provenance": {
      "locator": "Table II",
      "source_id": "kushibiki1999",
      "status": "P",
      "transcribed": "2026-10-25"
    },
    "public": true,
    "symbol": "v_S,Z",
    "uncertainty": {
      "type": "stated",
      "value": 0.23
    },
    "unit": {
      "display": "m/s",
      "ucum": "m/s"
    },
    "value": 3590.41,